{
  "schemaVersion": 1,
  "id": "concept.database",
  "type": "concept",
  "category": "system",
  "order": 16,
  "title": "数据库：持久化状态与一致性约束",
  "technicalTerm": "Database",
  "simpleExplanation": "数据库用结构化规则保存需要长期存在的数据，并支持查询、更新和一致性控制。",
  "analogy": "像有编目规则的档案馆：资料不仅要放进去，还要有编号、字段和借阅流程，才能可靠查找与修改。",
  "technicalExplanation": "数据库通过 Schema、类型、约束、索引和事务组织状态。Schema 变更会同时影响写入方、读取方、历史数据与回滚路径，因此生产迁移需要分阶段兼容和可观测验证。",
  "whyItMatters": "FDE 常遇到字段漂移、空值语义和零停机迁移问题。理解数据契约与读写兼容，才能避免修复一端却破坏另一端。",
  "commonMistakes": "把测试库的干净数据分布当成生产事实；一次性删除旧列；忽略 null 与缺失值差异；迁移后只看脚本成功而不验证应用读写。",
  "relatedFoundation": ["computer.data", "computer.database"],
  "relatedCases": [
    "etl-schema-drift-null-field-001",
    "zero-downtime-schema-migration-001"
  ]
}
