{
  "schemaVersion": 1,
  "id": "concept.rate-limit",
  "type": "concept",
  "category": "api-backend",
  "order": 10,
  "title": "限流：在共享容量内控制调用速率",
  "technicalTerm": "Rate Limit",
  "simpleExplanation": "限流给调用频率设上限，防止某个客户端耗尽共享服务容量。",
  "analogy": "像高速公路入口的信号灯，车辆不是永远禁止进入，而是按道路当前承载能力分批放行。",
  "technicalExplanation": "限流可按租户、用户、密钥或端点计数，常用固定窗口、滑动窗口或令牌桶。客户端应识别 429 与 Retry-After，控制并发、排队和退避，而不是立即并行重试。",
  "whyItMatters": "客户批处理经常在测试数据量扩大后触发配额。FDE 需要同时评估瞬时并发、持续速率和任务截止时间，给出可运行的节流方案。",
  "commonMistakes": "只降低单线程频率却保留大量并发；把 429 当永久失败；忽略不同端点或租户的独立配额；所有任务在同一时刻重试。",
  "relatedFoundation": ["api.rate-limit"],
  "relatedCases": ["api-rate-limit-retry-after-001"]
}
