{
  "schemaVersion": 1,
  "id": "concept.mvp",
  "type": "concept",
  "category": "fde",
  "order": 44,
  "title": "最小可行产品：验证端到端价值的最小闭环",
  "technicalTerm": "MVP",
  "simpleExplanation": "MVP 是能被真实目标用户完成核心工作流、并产生可测反馈的最小产品闭环。",
  "analogy": "像先开通一条真正载客的短途公交线：站点不多，但购票、运行、安全和反馈都必须完整，而不是只展示一辆样车。",
  "technicalExplanation": "MVP 在受控范围内覆盖真实输入、用户交互、关键集成、错误处理、基本安全和效果测量。它减少功能数量，但不省略验证核心价值所必需的端到端环节。",
  "whyItMatters": "FDE 要验证用户是否愿意持续使用，而不只是技术能否运行。MVP 数据帮助区分功能缺失、工作流摩擦和价值不足。",
  "commonMistakes": "把不可用原型称为 MVP；只测理想路径；没有用户行为指标；为了追求完整不断扩展范围；未说明暂不支持的边界。",
  "relatedFoundation": ["fde.poc-production-gap"],
  "relatedCases": ["customer-pilot-production-gap-001"]
}
