{
  "schemaVersion": 1,
  "id": "concept.prompt",
  "type": "concept",
  "category": "ai",
  "order": 28,
  "title": "提示词：组织目标、规则、上下文与证据",
  "technicalTerm": "Prompt",
  "simpleExplanation": "提示词是提供给模型的任务说明和上下文，告诉它要完成什么、遵守什么规则、依据哪些材料。",
  "analogy": "像给新同事一份任务简报：目标、边界、输入资料和交付格式越清楚，结果越容易验证，但简报不能替代权限控制。",
  "technicalExplanation": "完整提示由系统指令、开发约束、用户输入、检索证据、历史消息和工具结果共同构成。顺序、截断、冲突优先级和不可信内容边界都会影响模型行为。",
  "whyItMatters": "FDE 不能只编辑可见的用户文案。需要捕获实际发送给模型的完整上下文，确认关键规则是否被截断、证据是否靠后或工具输出是否注入指令。",
  "commonMistakes": "把外部文档当可信指令；无限追加上下文；用提示词承担鉴权；调整一句话后不使用固定评估集比较效果。",
  "relatedFoundation": [
    "ai.prompt",
    "ai.prompt-instruction-hierarchy",
    "ai.context-window",
    "ai.context-budgeting"
  ],
  "relatedCases": [
    "agent-tool-output-prompt-injection-001",
    "llm-prompt-context-order-001",
    "llm-streaming-backpressure-overload-001"
  ]
}
