{
  "schemaVersion": 1,
  "id": "concept.timeout-retry",
  "type": "concept",
  "category": "api-backend",
  "order": 9,
  "title": "超时与重试：在不确定结果下安全恢复",
  "technicalTerm": "Timeout / Retry",
  "simpleExplanation": "超时规定最多等多久，重试规定失败或不确定时何时再试；二者必须和幂等性一起设计。",
  "analogy": "像打电话无人接听后稍晚再拨，而不是所有人立刻连续拨号；对方可能已听到留言，所以不能每次都重复下单。",
  "technicalExplanation": "调用链需要分配端到端超时预算，区分连接、读取和业务超时。重试只适合可恢复错误，应设置次数上限、指数退避、随机抖动与总体截止时间，并确认操作可幂等或具备去重键。",
  "whyItMatters": "不受控重试会把局部抖动放大成级联故障，Agent 还可能重复执行有副作用的工具。FDE 应用时间线和请求 ID判断结果未知、明确失败还是已成功。",
  "commonMistakes": "每一层都使用相同长超时；对所有错误立即重试；忽略上游已取消的请求；重试创建或支付类动作却没有幂等键。",
  "relatedFoundation": [
    "api.timeout-retry",
    "api.retry-backoff-jitter",
    "api.timeout-budget"
  ],
  "relatedCases": [
    "agent-tool-timeout-retry-001",
    "api-timeout-budget-cascade-001",
    "third-party-retry-storm-001"
  ]
}
