{
  "schemaVersion": 1,
  "id": "concept.eval",
  "type": "concept",
  "category": "ai",
  "order": 40,
  "title": "评估：用独立数据与指标测量真实能力",
  "technicalTerm": "Eval",
  "simpleExplanation": "评估用代表真实任务的数据和明确指标，比较 AI 系统是否在质量、安全、成本与延迟上达到目标。",
  "analogy": "像驾照考试：不能拿练习时反复见过的路线证明所有道路都能安全驾驶，还要有独立考题和清晰评分标准。",
  "technicalExplanation": "Eval 需要独立数据集、任务分层、可重复配置、自动与人工评分、基线和统计不确定性。RAG 还应拆分召回与生成，Agent 还应检查工具选择、参数、完成率和副作用。",
  "whyItMatters": "模型量化、路由、提示或护栏变更都可能只影响特定长尾任务。FDE 用版本化评估门禁识别回归，避免凭演示样例上线。",
  "commonMistakes": "用调优数据做最终评估；只看平均分；指标与客户成功标准脱节；模型或提示版本未记录；忽略成本和延迟回归。",
  "relatedFoundation": [
    "ai.eval-dataset",
    "ai.eval-metrics",
    "ai.evaluation-guardrails",
    "ai.generation-randomness",
    "ai.hallucination-detection",
    "ai.fine-tuning-serving-fit"
  ],
  "relatedCases": [
    "inference-quantization-regression-001",
    "llm-eval-dataset-leakage-001",
    "llm-cost-routing-quality-regression-001"
  ]
}
