{
  "schemaVersion": 1,
  "id": "concept.idempotency",
  "type": "concept",
  "category": "api-backend",
  "order": 11,
  "title": "幂等性：重复请求不重复产生副作用",
  "technicalTerm": "Idempotency",
  "simpleExplanation": "幂等性保证同一个业务动作即使被重复提交，也只产生一次预期结果。",
  "analogy": "像用同一个取件码反复扫码，系统只会交付同一个包裹，不会凭空再生成多个包裹。",
  "technicalExplanation": "客户端为一次业务意图生成稳定幂等键，服务端原子记录键、请求摘要和结果。相同键与相同参数应返回既有结果，不同参数应拒绝；记录保留时间必须覆盖可能的重试窗口。",
  "whyItMatters": "网络超时只能说明调用方没有及时收到结果，不能证明服务端没有执行。Webhook 和 Agent 工具都需要幂等边界来避免重复写入或重复操作。",
  "commonMistakes": "每次重试生成新键；只在进程内存去重；用事件到达时间作为键；重复请求参数变化时仍静默返回旧结果。",
  "relatedFoundation": ["api.webhook-idempotency", "api.idempotency-key"],
  "relatedCases": [
    "api-webhook-idempotency-001",
    "agent-tool-timeout-retry-001"
  ]
}
