{
  "schemaVersion": 1,
  "id": "concept.metadata",
  "type": "concept",
  "category": "ai",
  "order": 33,
  "title": "元数据：描述来源、权限、版本与过滤条件",
  "technicalTerm": "Metadata",
  "simpleExplanation": "元数据是“描述数据的数据”，例如文档属于哪个租户、何时生效、来自哪里以及谁可以访问。",
  "analogy": "像档案盒外的标签：正文在盒内，标签决定它属于哪个部门、保密级别和版本，也帮助检索时先筛选范围。",
  "technicalExplanation": "RAG 元数据通常随 Chunk 写入索引，在查询时用于租户、权限、语言、时间和版本过滤。字段类型、缺失值、更新传播与区域一致性都会影响最终可见集合。",
  "whyItMatters": "权限过滤失效会造成数据泄露，版本过滤失效会返回旧政策。FDE 需要验证源记录、索引记录、查询过滤和返回结果四处的一致性。",
  "commonMistakes": "仅在生成提示中提醒模型不要泄露；用可变标题代替稳定 ID；新文档写元数据但旧文档未回填；不同区域采用不同字段类型。",
  "relatedFoundation": ["ai.metadata-filtering"],
  "relatedCases": [
    "rag-permission-filter-gap-001",
    "multi-region-rag-consistency-001"
  ]
}
