{
  "schemaVersion": 1,
  "id": "concept.retriever",
  "type": "concept",
  "category": "ai",
  "order": 34,
  "title": "检索器：从候选库召回相关证据",
  "technicalTerm": "Retriever",
  "simpleExplanation": "检索器接收查询，从知识库中找出可能包含答案的候选片段。",
  "analogy": "像图书馆员根据问题先挑出一摞可能相关的书；如果第一步漏掉关键书，后面的精读也无法补救。",
  "technicalExplanation": "检索器可使用向量、关键词或混合搜索，并应用过滤、Top-K、相似度阈值和查询改写。应分别测量目标证据是否被召回、排名位置和无答案查询的行为。",
  "whyItMatters": "提高 Top-K 可能增加召回，却同时稀释上下文并推高成本。FDE 需要用带证据标注的查询集确定参数，而不是凭单次回答调优。",
  "commonMistakes": "只看最终答案；盲目增大 Top-K；把低相似度结果强行交给模型；没有记录查询、过滤条件与索引版本。",
  "relatedFoundation": ["ai.retrieval-top-k-threshold"],
  "relatedCases": [
    "rag-top-k-context-dilution-001",
    "rag-stale-policy-cache-001"
  ]
}
