{
  "schemaVersion": 1,
  "id": "concept.root-cause",
  "type": "concept",
  "category": "system",
  "order": 22,
  "title": "根因：解释故障为何能够发生",
  "technicalTerm": "Root Cause",
  "simpleExplanation": "根因不是最后看到的错误，而是解释问题为何发生、为何未被及时阻止的可验证原因。",
  "analogy": "地板积水的直接原因是水流出来，根因可能是阀门失效、检查缺失和报警未接通；只擦地不能防止复发。",
  "technicalExplanation": "根因分析从事实时间线出发，区分触发条件、系统性原因、放大因素与检测缺口。结论应能解释全部关键证据，并对应可验证的纠正与预防措施。",
  "whyItMatters": "FDE 若把错误码当根因，修复往往只掩盖症状。深入到配置优先级、网络解析或就绪设计，才能提出不会轻易复发的改进。",
  "commonMistakes": "使用“人为失误”结束分析；把最先发现的问题当唯一原因；没有反证假设；行动项与分析结论无对应关系。",
  "relatedFoundation": ["fde.root-cause-analysis", "computer.debugging-loop"],
  "relatedCases": [
    "container-readiness-port-001",
    "dns-private-endpoint-001",
    "observability-correlation-id-001"
  ]
}
